chat_id,Details
37,"Maria Lopez: Hey Klaus! I couldn't help but notice you working on your research paper. What's your paper about?; Klaus Mueller: Hey Maria! My research paper is actually focused on the effects of gentrification in low-income communities. It's been really eye-opening to explore this topic.; Maria Lopez: That sounds fascinating! I'd love to hear more about your findings. Maybe we could grab coffee sometime and discuss it further?; Klaus Mueller: I would love to discuss my research findings with you over coffee. How about we meet up at Hobbs Cafe tomorrow around 2pm?; Maria Lopez: Great! I'll see you at Hobbs Cafe tomorrow at 2pm. Looking forward to it!; Klaus Mueller: Looking forward to our coffee chat tomorrow! I'll make sure to bring my research notes so we can dive into the details.; Maria Lopez: By the way, would you like to join me for dinner tonight at 6pm at Hobbs Cafe before our coffee chat tomorrow?; Klaus Mueller: That sounds like a great idea! I would love to join you for dinner at Hobbs Cafe tonight at 6pm.; Maria Lopez: Awesome! It's a date then. I'll see you at 6pm at Hobbs Cafe tonight.; Klaus Mueller: Should we exchange numbers so we can confirm the details for tomorrow's coffee chat?; Maria Lopez: Sure, let's exchange numbers. Here's mine: 555-123-4567. Looking forward to our chat tomorrow!; Klaus Mueller: Great! Here's my number: 555-987-6543. I'll text you later to confirm our plans for tomorrow.; Maria Lopez: I'll see you at 6pm at Hobbs Cafe then. Looking forward to catching up tonight!; Klaus Mueller: Great! I'm excited for dinner tonight at Hobbs Cafe. Looking forward to catching up before our coffee chat tomorrow!; Maria Lopez: I'll see you tonight at 6pm then. Have a great rest of your day, Klaus!; Klaus Mueller: I'm looking forward to our dinner tonight at Hobbs Cafe. See you at 6pm!"
38,"Maria Lopez: Hey Klaus, I couldn't help but notice you working on your research paper. What's your topic on?; Klaus Mueller: Hey Maria, thanks for noticing! I'm actually researching the effects of gentrification in low-income communities.; Maria Lopez: That sounds like a really interesting topic. How did you decide to research that?; Klaus Mueller: I've always been passionate about social justice and wanted to shed light on how gentrification impacts vulnerable communities.; Maria Lopez: That's really admirable. I'd love to hear more about your research findings once you're done!; Klaus Mueller: Thank you, Maria! I'd be happy to share my findings with you once I've completed my research.; Maria Lopez: Would you like to grab coffee sometime and discuss our research interests further?; Klaus Mueller: That sounds like a great idea, Maria! I would love to grab coffee and discuss our research interests further. How about we meet at Hobbs Cafe tomorrow at 3:00 pm?; Maria Lopez: That works for me, see you tomorrow at 3:00 pm at Hobbs Cafe!; Klaus Mueller: Great, looking forward to our coffee meeting tomorrow at Hobbs Cafe!; Maria Lopez: I'll see you tomorrow then. Have a great rest of your day, Klaus!; Klaus Mueller: Thanks, Maria! Have a great day too!"
39,"Maria Lopez: Hey Klaus, I couldn't help but notice you working on your research paper. What's your topic?; Klaus Mueller: Hi Maria, thanks for noticing. I'm actually researching the effects of gentrification in low-income communities.; Maria Lopez: That sounds really interesting! I've always been curious about urban development and its impact on communities. Do you have any specific case studies you're focusing on?; Klaus Mueller: Yes, I'm actually looking at a case study of a neighborhood in my city that has undergone significant gentrification in the past few years. It's been quite eye-opening to see the changes and the impact on the local residents.; Maria Lopez: That sounds really fascinating! I'd love to hear more about your findings and maybe even get involved in your research in some way.; Klaus Mueller: That would be fantastic, Maria! I'd love to have your perspective and insights on this topic. Maybe we could meet up later this week to discuss more?; Maria Lopez: That sounds great, Klaus! Let's plan to meet up on Thursday afternoon at the library to talk more about your research.; Klaus Mueller: Great, Thursday afternoon works for me. I'll see you at the library then!; Maria Lopez: I'm looking forward to our meeting on Thursday to discuss your research further. See you then!"
40,"Maria Lopez: Hi Klaus! I couldn't help but notice you working on your research paper. What's your topic?; Klaus Mueller: Hi Maria! Thanks for noticing. I'm actually researching the effects of gentrification in low-income communities.; Maria Lopez: That sounds fascinating! I'm interested in how different societal factors impact communities. Have you found any surprising results so far?; Klaus Mueller: Yes, I have actually found some unexpected findings. For example, the role of community engagement in mitigating the negative effects of gentrification was particularly interesting.; Maria Lopez: That's really intriguing. Do you think community-based initiatives could be a key solution to this issue?; Klaus Mueller: I absolutely think community-based initiatives have the potential to make a significant difference. I believe that empowering local residents to take an active role in shaping their neighborhood can lead to more sustainable solutions.; Maria Lopez: I completely agree with you. Empowering communities to take charge of their own development can create more inclusive and sustainable outcomes.; Klaus Mueller: I'm glad we share similar perspectives on community empowerment. It's inspiring to see how individuals can come together to create positive change.; Maria Lopez: Do you think there are any specific actions or policies that could support and promote community engagement in these contexts?; Klaus Mueller: I believe implementing policies that prioritize affordable housing and community input in urban development projects could be a practical way to support and promote community engagement. What do you think?; Maria Lopez: I think that's a great idea. Local residents should definitely have a say in how their community grows and develops. Have you considered conducting interviews or surveys with residents to gather their perspectives?; Klaus Mueller: I have actually conducted a few interviews with residents in different neighborhoods. The insights I gathered were really enlightening and added a valuable human perspective to my research.; Maria Lopez: That's great to hear! Including the voices of those directly impacted by gentrification in your research will definitely add depth and authenticity to your findings. Have you encountered any challenges in conducting these interviews?; Klaus Mueller: Yes, I encountered some challenges in conducting the interviews, especially in gaining the trust and participation of certain residents. Building rapport and addressing privacy concerns were crucial in overcoming these obstacles.; Maria Lopez: Have you thought about collaborating with local community organizations to further support your research findings?; Klaus Mueller: That's a fantastic idea, Maria. Collaborating with local community organizations could provide valuable insights and strengthen the impact of my research. Thank you for suggesting that."
41,"Maria Lopez: Hey Klaus, I couldn't help but notice you working on your research paper. What is it about?; Klaus Mueller: Hey Maria, my research paper is actually about the effects of gentrification in low-income communities.; Maria Lopez: That sounds really interesting! I'm actually studying physics but I find social issues like gentrification fascinating. Do you need any help with your research?; Klaus Mueller: Thank you, Maria! I would actually appreciate some insights on the statistical analysis section. Are you familiar with regression models?; Maria Lopez: Yes, I am familiar with regression models. I would be happy to help you with that section of your research paper!; Klaus Mueller: That would be great, Maria! How about we meet at the library tomorrow at 10am to go over the regression models together?; Maria Lopez: Sure, that works for me! I'll see you at the library tomorrow at 10 am."
42,"Maria Lopez: Hey Klaus! I saw you working on your research paper in the library. How's it going?; Klaus Mueller: Hey Maria! It's going well, just putting the finishing touches on the introduction.; Maria Lopez: That's great to hear! What is your research paper about?; Klaus Mueller: My research paper is on the effects of gentrification in low-income communities. I'm trying to highlight the social injustices that occur when wealthier individuals move into traditionally poorer areas.; Maria Lopez: That sounds like a really interesting topic! I'm actually studying physics, but I find social issues fascinating. Do you think your research will lead to any actionable change in those communities?; Klaus Mueller: I hope so, Maria. My goal is to raise awareness and spark discussions that could potentially lead to positive changes in these communities.; Maria Lopez: That's really admirable, Klaus. I think your research can definitely have a positive impact on those communities. Have you considered reaching out to local organizations or activists who work in those areas?; Klaus Mueller: Thank you for the suggestion, Maria. I hadn't thought about collaborating with local organizations, but it's a great idea. I'll definitely look into that.; Maria Lopez: I actually know a few organizations that work in low-income communities. I can introduce you to them if you'd like.; Klaus Mueller: That would be amazing, Maria! I would love to learn more about those organizations and see how I can collaborate with them.; Maria Lopez: Great! I'll send you some information about the organizations later today. We can chat more about it when you have time.; Klaus Mueller: Thank you so much, Maria! I really appreciate your help and support.; Maria Lopez: I'm looking forward to discussing more about your research and potential collaborations. Let's schedule a time to meet and dive deeper into this topic.; Klaus Mueller: Thank you, Maria! I'm excited to explore this further with you. Let's set up a time to meet and discuss the potential collaborations.; Maria Lopez: Let's plan to meet next week at the library to delve deeper into your research and potential collaborations.; Klaus Mueller: Thank you, Maria! I truly appreciate your willingness to help and your interest in my research. Meeting next week sounds perfect."
43,"Maria Lopez: Hey Klaus, I saw you working on your research paper at the library earlier. What's your paper about?; Klaus Mueller: Hey Maria! My research paper is actually about the effects of gentrification in low-income communities. I'm trying to examine how it impacts the residents and the overall dynamics of the community.; Maria Lopez: That sounds really interesting, Klaus. Have you found any surprising results so far?; Klaus Mueller: Well, actually, I've been finding that gentrification can have both positive and negative impacts, which is quite surprising. It's really fascinating to see how such a complex issue affects different aspects of a community.; Maria Lopez: That's really interesting, Klaus. I'd love to hear more about your findings and maybe discuss how it relates to some of the physics principles we've been learning in class.; Klaus Mueller: That sounds great, Maria. I would love to discuss the connections between gentrification and physics principles with you. Maybe we can grab coffee sometime and exchange ideas?; Maria Lopez: That sounds like a plan, Klaus. Let's set up a time to grab coffee and chat more about it.; Klaus Mueller: Great, I will text you later to set up a time. Looking forward to our coffee chat!; Maria Lopez: Sounds good, Klaus. I look forward to our discussion over coffee.; Klaus Mueller: I'll message you later. Have a great day, Maria!; Maria Lopez: Great, I'll be looking forward to your message. Have a great day, Klaus!; Klaus Mueller: I'll let you know about the coffee plans soon, Maria.; Maria Lopez: Sounds good, Klaus. Looking forward to our discussion over coffee.; Klaus Mueller: I'll message you later. Have a great day, Maria!; Maria Lopez: Great, I'll be looking forward to your message. Have a great day, Klaus!; Klaus Mueller: I have to go back to finishing up my research paper now. Talk to you soon, Maria!"
44,"Maria Lopez: Hey Klaus! I noticed you were working on your research paper at the library earlier. What's your paper about?; Klaus Mueller: Hey Maria! Thanks for noticing. My paper is actually about the effects of gentrification in low-income communities.; Maria Lopez: That sounds really interesting. I've been learning a lot about urban development in my physics classes. Do you think gentrification has a significant impact on the overall dynamics of a community?; Klaus Mueller: Yes, gentrification definitely plays a significant role in reshaping communities. It often leads to displacement of low-income residents and changes the social fabric of the neighborhood.; Maria Lopez: Do you think there are ways to mitigate the negative impacts of gentrification on these communities?; Klaus Mueller: I believe there are ways to mitigate the negative impacts of gentrification, such as implementing affordable housing policies and community outreach programs to support long-time residents.; Maria Lopez: That's a great point, Klaus. It's really important to consider the impact of urban development on all members of the community. I wonder if there are specific case studies or examples you've come across in your research that highlight these issues?; Klaus Mueller: I actually have come across some interesting case studies that highlight the negative impacts of gentrification on low-income communities. One example is the redevelopment of the Barrio neighborhood in San Diego, where long-time residents were pushed out due to rising property values and rent prices.; Maria Lopez: That's really insightful, Klaus. It's unfortunate how these changes can impact people's lives. Have you looked into any successful community initiatives that have effectively addressed gentrification issues?; Klaus Mueller: Yes, Maria, there have been successful community initiatives that have effectively addressed gentrification issues. For example, the Dudley Street Neighborhood Initiative in Boston empowered residents to have a say in the development process and ensure affordable housing options were available.; Maria Lopez: Wow, those examples are really eye-opening. It's inspiring to hear about communities coming together to address these challenges. Have you thought about incorporating any of these case studies into your research paper?; Klaus Mueller: That's a great suggestion, Maria. I think incorporating some case studies into my research paper would provide valuable insights into the different approaches communities have taken to address gentrification.; Maria Lopez: I would love to learn more about the Dudley Street Neighborhood Initiative in Boston. Do you have any resources or articles you could recommend for me to read up on?; Klaus Mueller: I can definitely share some resources with you, Maria. There are a few articles and reports that provide detailed information about the Dudley Street Neighborhood Initiative in Boston. I'll send them to you later today.; Maria Lopez: Thank you so much, Klaus. I'm really looking forward to reading up on the Dudley Street Neighborhood Initiative. It was great chatting with you!; Klaus Mueller: It was great chatting with you too, Maria. If you have any more questions or want to discuss further, feel free to reach out. I'll make sure to send you those resources about the Dudley Street Neighborhood Initiative in Boston later today."
45,"Maria Lopez: Hey Klaus, I couldn't help but notice you working on your research paper. What are you focusing on?; Klaus Mueller: Hi Maria, thanks for noticing. I'm actually writing about the effects of gentrification in low-income communities.; Maria Lopez: That sounds really interesting. I've been exploring topics related to social justice in my physics classes. Would you be open to collaborating on a project together?; Klaus Mueller: That's a great idea, Maria. I think our different perspectives could bring a unique insight to the project. Let's meet later this week to discuss how we could collaborate effectively.; Maria Lopez: That sounds like a plan. How about we meet at Hobbs Cafe this Thursday at 2pm to discuss further?; Klaus Mueller: Sure, that works for me. I'm looking forward to collaborating with you on this project.; Maria Lopez: Great, looking forward to it! I'll see you at Hobbs Cafe on Thursday at 2pm.; Klaus Mueller: I'll make a note of our meeting on Thursday at 2pm. Looking forward to it!; Maria Lopez: By the way, I really enjoyed your presentation in class last week. You brought up some thought-provoking points.; Klaus Mueller: Thank you, Maria. I appreciate your feedback on my presentation. I'm glad you found it thought-provoking.; Maria Lopez: I'm glad we connected today, Klaus. I'm looking forward to our collaboration on the project.; Klaus Mueller: Thanks, Maria. I'm glad we could connect today. Looking forward to our meeting on Thursday at Hobbs Cafe.; Maria Lopez: I'll see you on Thursday at Hobbs Cafe. Have a great rest of your day!; Klaus Mueller: Thank you, Maria. I look forward to our meeting on Thursday at Hobbs Cafe. Have a great day!; Maria Lopez: I'll reach out to you before Thursday to confirm our meeting time at Hobbs Cafe.; Klaus Mueller: Thanks, Maria. I'll keep an eye out for your message before Thursday. Have a great day!"
46,"Maria Lopez: Hey Klaus, I couldn't help but notice you working on your research paper. What's your topic about?; Klaus Mueller: Hey Maria, my research paper is actually about the effects of gentrification in low-income communities.; Maria Lopez: That sounds really interesting. I'd love to hear more about your research findings.; Klaus Mueller: Thank you, Maria. I'd be happy to share my research findings with you. Are you free this weekend?; Maria Lopez: I'm actually quite busy this weekend with studying and streaming, but I would love to hear more about your research. How about we grab a coffee at Hobbs Cafe during my lunch break tomorrow?; Klaus Mueller: That sounds great, Maria. I'll see you at Hobbs Cafe tomorrow during your lunch break.; Maria Lopez: Great, looking forward to it! See you tomorrow at Hobbs Cafe.; Klaus Mueller: I'll make sure to have my research findings ready to discuss with you tomorrow at Hobbs Cafe.; Maria Lopez: Hey Klaus, before I forget, do you prefer any particular type of coffee or snack at Hobbs Cafe?; Klaus Mueller: I usually go for a latte and a croissant at Hobbs Cafe. Thank you for asking, Maria.; Maria Lopez: Great, I'll make sure to order a latte and a croissant for you tomorrow at Hobbs Cafe. Looking forward to our chat!; Klaus Mueller: Thank you, Maria. I appreciate you ordering my favorite coffee and snack. I'm excited to chat with you tomorrow at Hobbs Cafe.; Maria Lopez: I'll see you tomorrow at Hobbs Cafe then. Have a great rest of your day, Klaus!; Klaus Mueller: Great, looking forward to it! See you tomorrow at Hobbs Cafe.; Maria Lopez: I have to head back to my physics lecture now, but I'll see you tomorrow at Hobbs Cafe.; Klaus Mueller: I'll make sure to bring my research notes so we can delve deeper into the topic tomorrow."
47,"Maria Lopez: Hey Klaus, I couldn't help but notice you working on your research paper. What's your topic about?; Klaus Mueller: Hey Maria, I'm actually researching the effects of gentrification in low-income communities. It's a topic I'm really passionate about.; Maria Lopez: That sounds really interesting, Klaus. Have you found any particular patterns or trends in your research so far?; Klaus Mueller: Yes, I've actually noticed a trend where the displacement of long-time residents leads to changes in the social fabric of the community.; Maria Lopez: That's fascinating, Klaus. Have you considered looking into potential solutions or interventions to address these issues?; Klaus Mueller: I have actually started looking into potential solutions such as community land trusts and affordable housing initiatives. It's a complex issue, but I'm hoping my research can shed some light on actionable steps.; Maria Lopez: That sounds like important work, Klaus. Have you considered reaching out to community organizations or experts in the field for their insights?; Klaus Mueller: That's a great suggestion, Maria. I'll definitely consider reaching out to community organizations and experts for their insights. Do you happen to know anyone in particular I should connect with?; Maria Lopez: I actually know a few people who work with community organizations focused on urban development. I can connect you with them if you're interested.; Klaus Mueller: That would be incredibly helpful, Maria. I would greatly appreciate any connections you can provide. Thank you so much for offering to help!; Maria Lopez: I'll reach out to them today and see if they're available to chat. I'll send you their contact information once I hear back.; Klaus Mueller: Thank you so much, Maria. I really appreciate your support in connecting me with those experts. I'm looking forward to hearing back from you.; Maria Lopez: Great, I'll follow up with them and let you know as soon as I hear back. It was nice chatting with you, Klaus!; Klaus Mueller: Thank you for your help, Maria. I really appreciate your willingness to connect me with those experts.; Maria Lopez: It was nice chatting with you, Klaus! I'll follow up with the community organizations and experts and let you know once I hear back.; Klaus Mueller: Thank you again, Maria. I look forward to hearing from you soon."
48,"Maria Lopez: Hey Klaus, how's your research paper coming along?; Klaus Mueller: Hey Maria, it's going well. I'm currently working on the introduction. How about you? How was the physics lecture?; Maria Lopez: The physics lecture was interesting as always. I'm actually working on an assignment related to the lecture material right now.; Klaus Mueller: That's great to hear. Do you need any help with your assignment?; Maria Lopez: Thank you Klaus, I appreciate the offer! I think I have it under control for now, but I'll definitely reach out if I need any help.; Klaus Mueller: That's good to hear. If you ever need a second pair of eyes on your assignment, feel free to ask. I always enjoy working through challenging problems.; Maria Lopez: Thank you Klaus, I will keep that in mind. How is your research paper going besides the introduction?; Klaus Mueller: I've been focusing on the effects of gentrification in low-income communities. It's been a thought-provoking process.; Maria Lopez: That sounds like a fascinating topic. Have you found any surprising results so far?; Klaus Mueller: I have actually uncovered some interesting findings that shed light on the complex dynamics at play in these communities.; Maria Lopez: That's really interesting, Klaus. I'd love to hear more about your findings sometime.; Klaus Mueller: I would be happy to share more details with you. How about we grab a coffee sometime and discuss it further?; Maria Lopez: That sounds like a great idea, Klaus. I would love to hear more about your research. How about we meet at Hobbs Cafe tomorrow after my physics lecture at 10am?; Klaus Mueller: Great, I'll see you tomorrow at 10am at Hobbs Cafe. Looking forward to our chat!; Maria Lopez: Great, I'll see you tomorrow at 10am at Hobbs Cafe. Looking forward to our chat!"
