chat_id,Details
1,"Maria Lopez: Hi Klaus! I saw you working on your research paper earlier, how's it coming along?; Klaus Mueller: Hey Maria! It's coming along pretty well, just finishing up the introduction. How about you? How was the physics lecture?; Maria Lopez: The physics lecture was interesting as always! I learned a lot about quantum mechanics today.; Klaus Mueller: That sounds fascinating! Quantum mechanics is such an intriguing topic. I'm curious, have you ever thought about how quantum principles could potentially impact social dynamics in our everyday lives?; Maria Lopez: That's a really interesting question, Klaus. I've actually been contemplating that recently. I think quantum principles could definitely have an impact on how we perceive and interact with the world around us.; Klaus Mueller: That's great to hear! It's always fascinating to explore the connections between seemingly different fields. I'd love to hear more about your thoughts on this. Maybe we can grab a coffee sometime and discuss it further?; Maria Lopez: That sounds like a great idea, Klaus! I'm always up for a good discussion. How about we meet at Hobbs Cafe tomorrow after my physics lecture?; Klaus Mueller: Perfect! Let's meet at Hobbs Cafe tomorrow after your physics lecture. I'm looking forward to our discussion.; Maria Lopez: Sounds like a plan! I'll see you at Hobbs Cafe tomorrow after my physics lecture.; Klaus Mueller: Great! Looking forward to it. I'll see you at Hobbs Cafe tomorrow after your physics lecture."
2,"Maria Lopez: Hey Klaus, I couldn't help but notice you working on your research paper. What's your topic about?; Klaus Mueller: Hi Maria, thank you for noticing! My research paper is actually about the effects of gentrification in low-income communities.; Maria Lopez: That sounds really interesting! I've always been curious about urban development and its impacts on communities.; Klaus Mueller: Yes, it's a complex issue that I feel really passionate about. What about you, Maria? What topics are you interested in?; Maria Lopez: I'm actually studying physics at Oak Hill College, so I'm really interested in topics related to astrophysics and particle physics. It's fascinating how the universe works on a micro and macro level.; Klaus Mueller: That's really interesting, Maria! I've always been fascinated by the complexities of physics. Have you come across any recent developments in astrophysics or particle physics that have caught your attention?; Maria Lopez: I recently read about the discovery of a new exoplanet that could potentially support life. It's amazing to think about the possibilities beyond our own planet.; Klaus Mueller: That's fascinating! The idea of life beyond our planet is truly mind-blowing. Have you considered the ethical implications of potential contact with extraterrestrial life forms?; Maria Lopez: I haven't thought about the ethical implications too much, but it's definitely a thought-provoking topic. I wonder how different societies would interact if contact was established.; Klaus Mueller: It's incredible to consider how our understandings of physics and social issues intersect. I believe exploring these connections can lead to a deeper understanding of our world.; Maria Lopez: I agree, the intersection of physics and social issues is truly fascinating. It's amazing how interconnected everything is.; Klaus Mueller: I completely agree, Maria. It's fascinating to see how different disciplines can inform each other. Maybe we can continue this conversation over lunch sometime?; Maria Lopez: That sounds like a great idea! I would love to continue this conversation over lunch.; Klaus Mueller: Great! How about we meet at Hobbs Cafe tomorrow at 1pm to continue our conversation?; Maria Lopez: That sounds perfect! I'll see you tomorrow at 1pm at Hobbs Cafe.; Klaus Mueller: Great, I look forward to it! See you tomorrow at 1pm at Hobbs Cafe."
3,"Maria Lopez: Hi Klaus! I couldn't help but notice you working on your research paper. What is your paper about?; Klaus Mueller: Hi Maria! Thank you for noticing. My research paper is actually about the effects of gentrification in low-income communities.; Maria Lopez: That sounds really interesting! I have always been curious about how urban development impacts communities.; Klaus Mueller: Yes, it is a fascinating topic to explore. I find it really intriguing how urban development can have such a significant impact on the social fabric of communities.; Maria Lopez: I would love to hear more about your findings and research process. Do you think gentrification has more positive or negative effects on low-income communities?; Klaus Mueller: I believe that gentrification can have a mix of both positive and negative effects on low-income communities. While it can bring in new investment, improve infrastructure, and potentially increase property values, it can also lead to displacement of longtime residents, loss of affordability, and erasure of community culture. It's a complex issue that requires careful analysis and consideration of all stakeholders' perspectives.; Maria Lopez: I completely agree with your insights. It's crucial to consider the long-term impact on the residents and community culture. Have you encountered any specific case studies that exemplify these complexities?; Klaus Mueller: Yes, I have actually come across some fascinating case studies that illustrate these complexities. One particular case I found intriguing was the redevelopment of the Sycamore Street neighborhood in which long-time residents were pushed out due to rising property values. It's a clear example of the challenges faced by communities undergoing gentrification.; Maria Lopez: That case study sounds really heartbreaking. It's unfortunate to see communities torn apart in the name of development. I think it's important for researchers like you to shine a light on these issues to create awareness and drive change.; Klaus Mueller: Thank you for your understanding and support, Maria. It's encouraging to know that there are others who see the importance of examining these issues. I hope to contribute to raising awareness and advocating for more equitable urban development practices.; Maria Lopez: It's been really insightful discussing this with you, Klaus. I appreciate your perspective and the work you are doing to shed light on these important issues.; Klaus Mueller: Would you be interested in collaborating on a research project in the future? I think your insights would add a valuable perspective to the topic.; Maria Lopez: That sounds like a great idea, Klaus! I would love to collaborate on a research project in the future. Let's exchange contact information and discuss further details.; Klaus Mueller: Let's exchange contact information and discuss further details."
4,"Maria Lopez: Hey Klaus, I saw you working on your research paper earlier. How's it going?; Klaus Mueller: Hey Maria, thanks for asking. It's going pretty well, I'm currently working on the introduction. How about you, how was the physics lecture?; Maria Lopez: The physics lecture was interesting today, we talked about quantum mechanics. How's your research paper coming along?; Klaus Mueller: I'm glad to hear that the physics lecture was interesting. My research paper is progressing well, thank you for asking. I'm currently reviewing my research question and objectives.; Maria Lopez: That's great to hear! Quantum mechanics can be such a fascinating topic. I'm actually working on my physics assignment related to it right now.; Klaus Mueller: That's really interesting, Maria. Quantum mechanics is such a complex yet fascinating subject to study. How are you finding the assignment so far?; Maria Lopez: I'm finding the assignment challenging but really rewarding. I enjoy delving into the complexities of quantum mechanics.; Klaus Mueller: It's impressive that you're tackling such a challenging topic. I'd love to hear more about your physics assignment sometime.; Maria Lopez: I'd be happy to discuss my physics assignment with you further. Would you like to grab a coffee sometime and chat about it?; Klaus Mueller: That sounds great, Maria. I would love to grab a coffee and chat more about your physics assignment. How about we meet at Hobbs Cafe tomorrow at 1:00 pm?; Maria Lopez: Perfect! I'll see you tomorrow at Hobbs Cafe at 1:00 pm then. Looking forward to our coffee chat."
5,"Maria Lopez: Hey Klaus, I saw you working on your research paper in the library. What's your topic about?; Klaus Mueller: Hey Maria, my research paper is about the effects of gentrification in low-income communities.; Maria Lopez: That sounds really interesting. I've always been passionate about social issues. Do you have any specific examples or case studies you're looking at?; Klaus Mueller: Yes, I'm looking at the impact of gentrification in a specific neighborhood in our city. It's really fascinating to see how this process has affected the local community.; Maria Lopez: That's really interesting. I'd love to hear more about your findings and possibly learn more about how I can contribute to understanding this issue.; Klaus Mueller: I would be happy to share more with you. Maybe we could grab coffee sometime and discuss it further?; Maria Lopez: That sounds great, Klaus. I would love to grab coffee and discuss this further with you.; Klaus Mueller: Great, let's exchange numbers and we can set up a time to meet up for coffee. Here's my number: XXX-XXX-XXXX. Feel free to text me whenever works best for you.; Maria Lopez: Thanks, Klaus. I'll text you soon to set up a time for coffee!; Klaus Mueller: Great, looking forward to our coffee chat. Have a good time at the lecture!; Maria Lopez: Thank you, Klaus. I'm really looking forward to our coffee chat as well. Enjoy the rest of your day!; Klaus Mueller: Let's plan to meet at the coffee shop near campus, say next Thursday at 3 pm. Does that work for you?; Maria Lopez: That works for me, Klaus. I'll see you at the coffee shop next Thursday at 3 pm.; Klaus Mueller: Great, looking forward to our coffee chat. Have a good time at the lecture!; Maria Lopez: Thank you, Klaus. I'm really looking forward to our coffee chat as well. Enjoy the rest of your day!; Klaus Mueller: Have a great time at the lecture, Maria. Looking forward to our coffee chat next Thursday at 3 pm!"
6,"Maria Lopez: Hey Klaus! I saw you working on your research paper at the library earlier, how's it going?; Klaus Mueller: Hey Maria! It's going well, just finishing up the introduction.; Maria Lopez: That's great to hear! What's your research about?; Klaus Mueller: My research paper is actually about the effects of gentrification in low-income communities. I'm trying to understand the different perspectives on this issue.; Maria Lopez: That sounds really interesting! I'm actually studying physics, but I'm always curious about social issues like gentrification. Do you think these effects have a significant impact on the community as a whole?; Klaus Mueller: Yes, gentrification can have a significant impact on low-income communities, affecting housing prices, displacement of residents, and the overall social fabric of the neighborhood.; Maria Lopez: I completely agree, it's important to consider the long-term consequences of these changes. Have you found any interesting patterns or data in your research so far?; Klaus Mueller: I've actually found some interesting patterns regarding the displacement of long-time residents and the impact on local businesses. Would you be interested in hearing more about it?; Maria Lopez: Yes, I would love to hear more about the patterns you've found regarding the displacement of long-time residents and the impact on local businesses.; Klaus Mueller: I'm actually planning to visit a few of these neighborhoods next week to gather more insights and data. Would you be interested in joining me?; Maria Lopez: That sounds like a great opportunity to learn more about the topic. I would love to join you on your visit to those neighborhoods.; Klaus Mueller: Great! I'll send you the details of our visit next week. It will be interesting to explore these neighborhoods together.; Maria Lopez: Thank you for inviting me to join you on the visit next week. I'm really looking forward to exploring those neighborhoods and learning more about your research.; Klaus Mueller: I'm glad you're interested in joining me! It would be great to have your perspective on the issue.; Maria Lopez: Thank you, Klaus. I'm really excited to learn more about your research and to contribute in any way I can.; Klaus Mueller: I'm glad you're interested in joining me! It would be great to have your perspective on the issue."
7,"Maria Lopez: Hey Klaus, I noticed you're working on your research paper. What's your topic about?; Klaus Mueller: Hey Maria, I'm actually researching the effects of gentrification in low-income communities. It's a topic I'm really passionate about.; Maria Lopez: That sounds really interesting! I'd love to hear more about your research findings.; Klaus Mueller: I'd be happy to share my research findings with you, Maria. How about we grab a coffee sometime this week and I can walk you through my paper?; Maria Lopez: That sounds great, I would love to grab coffee with you and discuss your research further. How about we meet at Hobbs Cafe tomorrow around 2pm?; Klaus Mueller: That works for me, Maria. I look forward to discussing my research with you tomorrow at Hobbs Cafe.; Maria Lopez: Should I bring anything with me for our coffee meeting tomorrow?; Klaus Mueller: Just bring your curiosity and questions, Maria. I'll have all the research materials ready for our discussion.; Maria Lopez: Great! I'll see you at Hobbs Cafe tomorrow at 2pm then. Looking forward to our coffee chat.; Klaus Mueller: See you tomorrow at 2pm at Hobbs Cafe, Maria!; Maria Lopez: Thanks, Klaus. I'll see you tomorrow at Hobbs Cafe!; Klaus Mueller: I'll make sure to bring some extra notes and key points to our coffee meeting tomorrow.; Maria Lopez: Alright, looking forward to it! See you tomorrow at 2pm.; Klaus Mueller: I'll also bring my laptop to show you some visuals related to my research findings.; Maria Lopez: Great, I can't wait to dive deeper into your research. See you tomorrow at Hobbs Cafe!; Klaus Mueller: Looking forward to our coffee chat tomorrow, Maria! Have a great rest of your day."
8,"Maria Lopez: Hey Klaus, I saw you working on your research paper at the library, how's it going?; Klaus Mueller: Hey Maria, thanks for noticing! I'm making progress with the introduction, but I'm still fine-tuning some details. How about you? How was the physics lecture?; Maria Lopez: The physics lecture was pretty interesting, we were discussing quantum mechanics and I found it really fascinating. How's your research going?; Klaus Mueller: That sounds really interesting! I'm focusing on the effects of gentrification in low-income communities for my research paper. It's a challenging topic, but I'm learning a lot.; Maria Lopez: That's a really important topic, Klaus. I would love to hear more about your research and maybe even discuss some ideas on how to address the challenges faced by those communities.; Klaus Mueller: I would love to chat more about my research with you, Maria. How about we grab a coffee sometime this week and discuss it further?; Maria Lopez: That sounds like a plan, Klaus. How about we meet at Hobbs Cafe on Thursday afternoon?; Klaus Mueller: Great! Thursday afternoon works for me. I'll see you at Hobbs Cafe then.; Maria Lopez: Looking forward to our coffee meeting on Thursday. I'm excited to hear more about your research.; Klaus Mueller: I'll let you know if there are any updates on my research findings before our meeting on Thursday.; Maria Lopez: Great! I'll make sure to come prepared with some ideas to discuss on Thursday.; Klaus Mueller: I'll get back to work on my research paper now. See you on Thursday at Hobbs Cafe!; Maria Lopez: Great! I look forward to our coffee meeting on Thursday. I'll make sure to come prepared with some ideas to discuss.; Klaus Mueller: I'll let you know if there are any updates on my research findings before our meeting on Thursday.; Maria Lopez: Good luck with your research, Klaus! I'll be sure to come prepared with some ideas to discuss on Thursday.; Klaus Mueller: Thank you, Maria! I appreciate your interest in my research. I'm looking forward to our discussion on Thursday."
9,"Maria Lopez: Hey Klaus, I saw you working on your research paper at the library earlier. What's your paper about?; Klaus Mueller: Hey Maria, my research paper is actually about the effects of gentrification in low-income communities. I'm really passionate about social justice and exploring different perspectives.; Maria Lopez: That sounds really interesting! I also love exploring different viewpoints on social issues. Have you found any surprising findings in your research?; Klaus Mueller: Yes, actually. I found that the process of gentrification not only displaces low-income residents but also has a ripple effect on the overall community dynamics.; Maria Lopez: That's really eye-opening. Do you plan to propose any solutions in your paper?; Klaus Mueller: Yes, I am considering proposing some community-driven solutions to address the negative impacts of gentrification. I believe that involving local residents in the decision-making process is crucial for creating sustainable solutions.; Maria Lopez: That's a really thoughtful approach, Klaus. I agree that involving the community in finding solutions is key. Have you considered conducting interviews or surveys with residents to gather their input?; Klaus Mueller: I actually have considered conducting interviews with residents to gather their input. I think it's important to have their voices heard in the research.; Maria Lopez: That's a great idea, Klaus. Would you like any assistance with conducting the interviews or analyzing the data?; Klaus Mueller: Thank you for offering your assistance, Maria. I would definitely appreciate your help with conducting interviews and analyzing the data.; Maria Lopez: Great, let's set up a time to discuss the details and plan for the interviews. I'm excited to collaborate on this project with you, Klaus!; Klaus Mueller: Thank you for your offer, Maria. I think discussing the details and planning for the interviews would be really beneficial. How about we meet tomorrow afternoon at the library to go over everything?; Maria Lopez: Sounds like a plan, Klaus! I'll see you at the library tomorrow afternoon.; Klaus Mueller: Great, looking forward to our meeting tomorrow! I'll see you at the library in the afternoon.; Maria Lopez: It was great chatting with you, Klaus! I'm looking forward to working together on this project.; Klaus Mueller: I'm glad we're on the same page, Maria. This collaboration is going to be really valuable for our research paper."
10,"Maria Lopez: Hey Klaus, I noticed you were working on your research paper. What is your paper about?; Klaus Mueller: Hey Maria, my research paper is actually about the effects of gentrification in low-income communities. I'm really passionate about social justice and exploring different perspectives.; Maria Lopez: That sounds really interesting, Klaus. I'd love to hear more about your findings and how you're conducting your research.; Klaus Mueller: Thank you, Maria. I'm currently reviewing my research question and objectives to ensure I cover all aspects of the topic.; Maria Lopez: That's really intriguing, Klaus. I'm curious to learn more about your methodology and data analysis as well.; Klaus Mueller: I actually plan to conduct interviews with residents in the affected communities to gather their perspectives and experiences firsthand.; Maria Lopez: That sounds like a very impactful approach, Klaus. Have you considered incorporating any quantitative data to complement the qualitative insights from the interviews?; Klaus Mueller: I have thought about including quantitative data in my research as well. I believe combining both qualitative insights and quantitative analysis will provide a comprehensive understanding of the effects of gentrification.; Maria Lopez: Your approach to combining qualitative and quantitative methods sounds very thorough and insightful, Klaus. Have you thought about potential challenges in conducting these interviews and collecting data?; Klaus Mueller: Thank you for raising that point, Maria. Conducting interviews and collecting data can indeed present challenges, such as ensuring the confidentiality and trust of participants. I plan to address these challenges by establishing clear protocols and building rapport with the community members.; Maria Lopez: It's great that you're considering those challenges, Klaus. Building trust with the community members is crucial for the success of your research. Have you thought about reaching out to local community organizations for support and collaboration?; Klaus Mueller: I haven't reached out to local community organizations yet, but that's a great suggestion, Maria. I will definitely consider collaborating with them to enhance the impact of my research.; Maria Lopez: It's inspiring to see your dedication to conducting meaningful research that will make a positive impact. If you ever need any assistance or support with your project, feel free to reach out. I believe collaboration and shared learning can enrich our work even further.; Klaus Mueller: Thank you for your offer, Maria. I truly appreciate your support and willingness to collaborate. Your insights have been invaluable, and I will definitely reach out if I need assistance with my project. I believe our shared dedication to social justice and meaningful research can create a positive impact.; Maria Lopez: It's always inspiring to see passionate researchers like yourself, Klaus. I look forward to hearing more about your progress and findings as you continue your work.; Klaus Mueller: Thank you, Maria. I'm glad to have the opportunity to share my research with you. I'll keep you updated on my progress and findings as I continue working on my paper."
11,"Maria Lopez: Hey Klaus, I couldn't help but notice you working on your research paper. What's your topic about?; Klaus Mueller: Hey Maria, thanks for noticing! I'm actually researching the effects of gentrification in low-income communities.; Maria Lopez: That sounds really interesting! How did you choose that topic?; Klaus Mueller: I chose this topic because I am passionate about social justice and want to shed light on the impact gentrification has on marginalized communities.; Maria Lopez: That's a noble cause. Have you found any surprising conclusions so far?; Klaus Mueller: I've actually found that while gentrification may bring economic development to an area, it often leads to displacement and loss of cultural identity for long-time residents.; Maria Lopez: That's really eye-opening. I hope your research can bring about positive change in those communities.; Klaus Mueller: Thank you, Maria. I appreciate your interest in my research. Have you ever thought about how physics can influence societal issues like gentrification?; Maria Lopez: Physics has the power to explain the underlying principles behind societal issues like gentrification. For example, understanding the concepts of energy conservation and dynamics could help us analyze the forces at play in a community undergoing gentrification.; Klaus Mueller: That's a fascinating perspective, Maria. It's amazing how different fields of study can intersect to provide a deeper understanding of complex issues. Thank you for sharing your insights.; Maria Lopez: I completely agree! It's fascinating to see how interdisciplinary approaches can lead to innovative solutions. Have you thought about collaborating with other researchers in different fields to broaden the impact of your research?; Klaus Mueller: I haven't thought about collaborating with researchers from other fields, but that's a great idea. It could definitely bring a new perspective to my research. Thank you for suggesting that, Maria.; Maria Lopez: It's always beneficial to have a diverse range of perspectives when conducting research. Maybe we can discuss some ideas for collaboration further over a cup of coffee at Hobbs Cafe sometime.; Klaus Mueller: That sounds like a great idea, Maria. I would love to discuss potential collaborations over a cup of coffee at Hobbs Cafe. How about we meet there tomorrow at 10:00 am?; Maria Lopez: Great, I'll see you at Hobbs Cafe tomorrow at 10:00 am. Looking forward to our discussion on potential collaborations!"
