chat_id,Details
24,"Maria Lopez: Hey Klaus, I see you're deep into your research paper. What is your research question about?; Klaus Mueller: Hey Maria, my research question is centered around the effects of gentrification in low-income communities.; Maria Lopez: That's a really interesting topic! Have you found any surprising findings so far?; Klaus Mueller: Yes, I actually found that while gentrification brings in new economic opportunities, it also displaces long-time residents and disrupts the sense of community. It's a complex issue with both positive and negative impacts.; Maria Lopez: That's really fascinating. Have you considered any potential solutions to mitigate the negative impacts of gentrification?; Klaus Mueller: Yes, I have been considering various solutions such as affordable housing initiatives, community-driven development projects, and policies to protect long-time residents from eviction.; Maria Lopez: That's really insightful, Klaus. I think community involvement is crucial in finding sustainable solutions. Have you looked into any case studies or examples where these initiatives have been successful?; Klaus Mueller: Yes, I've actually been researching case studies in cities like Portland and San Francisco where community-driven initiatives have successfully preserved affordable housing and promoted cultural diversity. It's inspiring to see how residents came together to create positive change.; Maria Lopez: Those case studies sound really inspiring. Have you thought about expanding your research to include international examples?; Klaus Mueller: I haven't delved into international examples yet, but that's a great suggestion. I'll definitely look into that to get a broader perspective on the issue.; Maria Lopez: That sounds like a promising direction for your research. I would love to hear more about your findings once you've explored international examples.; Klaus Mueller: Thank you for the suggestion, Maria. I'll definitely look into international examples and share my findings with you once I have more information.; Maria Lopez: I'm really impressed with the depth of your research. Would you be open to collaborating on a project in the future?; Klaus Mueller: Thank you, Maria. I appreciate your interest in my research. I would be open to collaborating on a project in the future. Let's definitely keep in touch and explore potential opportunities. Your insights have been incredibly valuable.; Maria Lopez: It's been great chatting with you, Klaus. I look forward to potentially collaborating on a future project. Let's definitely keep in touch and exchange ideas.; Klaus Mueller: It's been wonderful talking to you, Maria. I'll make sure to keep you updated on my research progress and definitely explore the international examples as you suggested. Let's definitely collaborate on a project in the future."
25,"Maria Lopez: Hey Klaus, I noticed you were working on your research paper. What's it about?; Klaus Mueller: Hey Maria, I'm actually researching the effects of gentrification in low-income communities.; Maria Lopez: That's really interesting, Klaus. How did you decide on that topic?; Klaus Mueller: I chose this topic because I've seen firsthand how gentrification affects communities I care about. It's something I'm really passionate about.; Maria Lopez: That sounds like important work, Klaus. Have you found any surprising results so far?; Klaus Mueller: Yes, actually. One surprising result I found is that despite promises of 'urban revitalization', many long-time residents are actually displaced from their homes due to rising property values.; Maria Lopez: That's really eye-opening, Klaus. Have you thought about potential solutions to help mitigate the negative impacts of gentrification?; Klaus Mueller: I have been considering different approaches, such as implementing affordable housing initiatives and community land trusts to ensure long-time residents can remain in their neighborhoods.; Maria Lopez: Those solutions sound really promising, Klaus. Have you thought about reaching out to local community organizations for support?; Klaus Mueller: I think that's a great idea, Maria. I will definitely reach out to local community organizations for support and input on my research. Thank you for suggesting that!; Maria Lopez: I'm actually involved in some community outreach programs myself. Maybe we can collaborate on our projects and combine our efforts to make a bigger impact.; Klaus Mueller: That sounds like a great idea, Maria. I would love to collaborate with you on our projects and work towards making a positive impact together.; Maria Lopez: I will send you an email with some more details about the community organizations I work with. Let's definitely connect and see how we can collaborate further.; Klaus Mueller: Thank you, Maria. I look forward to receiving your email and learning more about the community organizations you work with. I think our collaboration could really make a difference.; Maria Lopez: I'm excited to see how our collaboration unfolds and the impact we can make together. Looking forward to our continued discussions.; Klaus Mueller: Thank you, Maria. I appreciate your support and I'm excited to collaborate with you. Let's definitely work together to make a positive impact."
26,"Maria Lopez: Hi Klaus, I couldn't help but notice you working on your research paper in the library. What's your paper about?; Klaus Mueller: Hi Maria, my research paper is actually about the effects of gentrification in low-income communities. I'm passionate about social justice and wanted to delve deeper into this issue.; Maria Lopez: That sounds really interesting! I've been studying physics but I'm always fascinated by how different disciplines intersect. Would you like to grab a coffee sometime and discuss our research interests further?; Klaus Mueller: That sounds great, Maria! I would love to grab a coffee and chat about our research interests.; Maria Lopez: How about we meet at Hobbs Cafe tomorrow afternoon around 3pm?; Klaus Mueller: That works for me, Maria! I will see you at Hobbs Cafe tomorrow at 3pm."
27,"Maria Lopez: Hey Klaus! I noticed you working on your research paper. What is your paper about?; Klaus Mueller: Hey Maria! My research paper is about the effects of gentrification in low-income communities.; Maria Lopez: That sounds really interesting! How did you decide on that topic?; Klaus Mueller: I decided on the topic of gentrification because I am passionate about social justice and I believe it is an important issue that needs more attention. I wanted to shed light on the impact it has on marginalized communities.; Maria Lopez: That's really admirable. Have you found any surprising findings in your research so far?; Klaus Mueller: Thank you, Maria! Yes, I've actually found some surprising statistics regarding displacement rates in these communities. It's quite concerning.; Maria Lopez: It's definitely important to bring awareness to those statistics. I would love to hear more about your research findings sometime.; Klaus Mueller: Thank you, Maria! I would be happy to share more about my research findings with you. How about we grab a coffee sometime and I can go into more detail?; Maria Lopez: That sounds great, Klaus! I would love to grab a coffee with you and hear more about your research findings.; Klaus Mueller: Great! How about we meet at Hobbs Cafe tomorrow at 3:00 pm?; Maria Lopez: Sounds perfect! I'll see you tomorrow at 3:00 pm at Hobbs Cafe.; Klaus Mueller: Looking forward to our coffee date tomorrow at Hobbs Cafe!; Maria Lopez: I look forward to hearing more about your research tomorrow!; Klaus Mueller: Great! See you tomorrow at Hobbs Cafe!; Maria Lopez: Sounds good, Klaus. See you tomorrow at 3:00 pm at Hobbs Cafe!; Klaus Mueller: It was great chatting with you, Maria. I look forward to our coffee date tomorrow at Hobbs Cafe!"
28,"Maria Lopez: Hey Klaus, what area of physics is your research paper focused on?; Klaus Mueller: Actually, my research paper is focused on the effects of gentrification in low-income communities. It's for my sociology class.; Maria Lopez: That sounds really interesting! How are you approaching the study, from a quantitative or qualitative perspective?; Klaus Mueller: I'm actually taking a mixed methods approach for this study. I believe it's important to gather both quantitative data and qualitative insights to get a comprehensive understanding of the issue.; Maria Lopez: That's a great approach! Have you encountered any challenges so far in your research process?; Klaus Mueller: Thank you Maria. Yes, I've faced some challenges, especially in obtaining accurate data from the communities. It's been a learning experience for sure.; Maria Lopez: I hear you, obtaining accurate data can be tough. Have you considered using community partnerships to access the information you need?; Klaus Mueller: That's a great suggestion, Maria. I actually have been considering building partnerships with community organizations to gain better access to information. It's important to involve the community in the research process.; Maria Lopez: That sounds like a great idea, involving the community in the research process can provide valuable insights. Have you considered conducting focus groups or interviews to gather qualitative data directly from community members?; Klaus Mueller: I have actually considered conducting focus groups and interviews to gather qualitative data directly from community members. It would provide a more personal insight into the impact of gentrification on their lives.; Maria Lopez: It sounds like you have a comprehensive approach to your research. I'd love to hear more about your findings once you have them!; Klaus Mueller: Thank you, Maria! I will definitely share my findings with you once I have them. How about we meet for a coffee next week to discuss it further?; Maria Lopez: That sounds great, Klaus! I look forward to discussing your findings over coffee next week. Let me know a day and time that works for you.; Klaus Mueller: Great, how about we meet on Thursday afternoon at 3pm at Brew & Blend Cafe? Does that work for you?; Maria Lopez: Sounds perfect, Klaus! I'll see you at Brew & Blend Cafe on Thursday at 3pm."
29,"Maria Lopez: Hey Klaus, I saw you working on your research paper in the library. What topic are you focusing on?; Klaus Mueller: Hey Maria, I'm actually researching the effects of gentrification in low-income communities.; Maria Lopez: That's a very interesting topic. Have you found any surprising results so far?; Klaus Mueller: Yes, I have actually found some surprising results. The impact on the local culture and community ties has been much greater than I expected.; Maria Lopez: That's fascinating. I would love to hear more about your findings. Perhaps we could continue this conversation over coffee sometime?; Klaus Mueller: Sure, I'd be happy to discuss my findings with you over coffee. How about we meet at the campus cafe tomorrow around 10am?; Maria Lopez: Great, I'll see you at the campus cafe tomorrow at 10am. I'm excited to hear more about your research findings.; Klaus Mueller: Looking forward to our coffee chat tomorrow and hearing more about your physics lecture. It sounds intriguing!; Maria Lopez: Before our coffee chat tomorrow, I have a physics lecture in the morning. Why don't you join me for that as well?; Klaus Mueller: That sounds like a great idea, Maria. I'd love to join you for the physics lecture tomorrow.; Maria Lopez: Great, I'll send you the details of the physics lecture. Looking forward to our coffee chat tomorrow!; Klaus Mueller: Thanks for inviting me to the physics lecture. I'm really looking forward to it!; Maria Lopez: Great, I'll send you the details of the physics lecture. Looking forward to our coffee chat tomorrow!; Klaus Mueller: Thanks for inviting me to the physics lecture. I'm really looking forward to it!; Maria Lopez: Looking forward to seeing you at the campus cafe tomorrow at 10am! Have a great day, Klaus!; Klaus Mueller: Looking forward to our coffee chat tomorrow and hearing more about your physics lecture. It sounds intriguing!"
30,"Maria Lopez: Hey Klaus, I couldn't help but notice you working on your research paper. What is your topic about?; Klaus Mueller: Hey Maria! Thank you for noticing. My research paper is actually about the effects of gentrification in low-income communities.; Maria Lopez: That sounds really interesting! I've always been curious about urban development. Do you have any specific case studies or data you're working with?; Klaus Mueller: Yes, I'm actually focusing on a specific neighborhood in our city and analyzing the impact on the local community. I'm using a mix of qualitative interviews and quantitative data to get a comprehensive understanding.; Maria Lopez: That sounds like a really insightful approach. I'd love to hear more about your findings and methodology as you progress. Maybe we could grab coffee sometime and discuss it further?; Klaus Mueller: That sounds great, Maria! I would love to discuss my research with you over coffee. How about we meet at the campus cafe tomorrow afternoon?; Maria Lopez: That sounds perfect, Klaus! I look forward to our coffee discussion tomorrow afternoon.; Klaus Mueller: Great, I'll see you at the campus cafe tomorrow afternoon then!; Maria Lopez: I'll see you tomorrow at the campus cafe, Klaus. Looking forward to our discussion!; Klaus Mueller: I'll make sure to bring some of the interesting data and findings I've gathered so far to our coffee meeting.; Maria Lopez: Great, I can't wait to hear more about your research. See you tomorrow at the campus cafe!; Klaus Mueller: I'll see you tomorrow at the campus cafe! Have a great day, Maria.; Maria Lopez: Great, I'll make sure to bring some of the interesting data and findings I've gathered so far as well. Looking forward to our coffee meeting tomorrow afternoon!; Klaus Mueller: I'll send you a message later to coordinate the specifics of our coffee meeting tomorrow.; Maria Lopez: Great, I'll make sure to bring some of the interesting data and findings I've gathered so far as well. Looking forward to our coffee meeting tomorrow afternoon!; Klaus Mueller: I'll send you a message later to coordinate the specifics of our coffee meeting tomorrow."
31,"Maria Lopez: Hey Klaus! I couldn't help but notice you working on your research paper. What's your paper about?; Klaus Mueller: Hey Maria! My research paper is actually about the effects of gentrification in low-income communities. I'm trying to understand how urban development impacts the long-time residents of those areas. It's quite fascinating to see the social dynamics at play.; Maria Lopez: That sounds really interesting! I'm studying physics, but I'm always fascinated by how different fields intersect. Do you think there are any parallels between your research and physics?; Klaus Mueller: That's a great point, Maria! Actually, I think there are parallels between our fields. Both sociology and physics seek to explain complex systems, just in different ways. For example, while I study social structures and interactions, you study the fundamental laws of nature. It's fascinating how interconnected our world really is.; Maria Lopez: That's a really interesting perspective, Klaus. I never thought about the similarities between sociology and physics in that way. It just goes to show how interconnected our world truly is!; Klaus Mueller: I completely agree, Maria. It's amazing how different fields can find common ground in exploring the intricacies of our world. Have you ever thought about how physics principles might apply to social phenomena?; Maria Lopez: I've never thought about applying physics principles to social phenomena, but that's a really intriguing idea. I would love to hear more about your research and how you approach studying these complex systems.; Klaus Mueller: I would be happy to share more about my research with you, Maria. Would you be interested in meeting up sometime to discuss it further?; Maria Lopez: I would love to meet up and learn more about your research! How about we grab coffee at Hobbs Cafe tomorrow at 2pm?; Klaus Mueller: Great! Let's meet at Hobbs Cafe tomorrow at 2pm to discuss further.; Maria Lopez: It was great chatting with you, Klaus. I'm looking forward to our coffee meet-up tomorrow at 2pm!; Klaus Mueller: It was great chatting with you too, Maria. I'll see you tomorrow at Hobbs Cafe at 2pm!; Maria Lopez: Hey Klaus, before I forget, do you mind if I bring my friend Sarah along to our coffee meet-up tomorrow at Hobbs Cafe?; Klaus Mueller: Sure, I'd love to meet Sarah as well! The more the merrier. See you both tomorrow at Hobbs Cafe at 2pm.; Maria Lopez: Hey Klaus, it was great meeting you! I'll see you tomorrow at Hobbs Cafe at 2pm with Sarah.; Klaus Mueller: It was great meeting you too, Maria! I'm looking forward to our coffee meet-up with Sarah tomorrow at Hobbs Cafe at 2pm."
32,"Maria Lopez: Hey Klaus, I saw you working on your research paper at the library earlier. How's that going?; Klaus Mueller: Hey Maria, thanks for asking. It's going well, I'm almost done with the introduction. How about you, how's the physics lecture going?; Maria Lopez: The physics lecture is interesting, I always enjoy learning new concepts. Are you planning on joining us for the group study session later at the library?; Klaus Mueller: I would love to join for the group study session later. Thank you for inviting me!; Maria Lopez: Great! I look forward to discussing more physics concepts with you during the session.; Klaus Mueller: I'm glad you find the physics lecture interesting. I'm excited to learn more from you during the group study session.; Maria Lopez: So, what aspect of physics research are you most passionate about?; Klaus Mueller: I'm actually a sociology student, so my research is focused on the effects of gentrification in low-income communities. It's a topic I'm very passionate about.; Maria Lopez: That sounds like a fascinating research topic! I'm sure there are a lot of interesting insights you've uncovered.; Klaus Mueller: Thank you, Maria. I appreciate your interest in my research. I'm always open to discussing the topic further if you're interested.; Maria Lopez: I would love to hear more about your research on the effects of gentrification in low-income communities. It's such an important topic that needs to be discussed.; Klaus Mueller: Thank you, Maria. I would be happy to share more details with you. How about we meet before the group study session to discuss it further?; Maria Lopez: That sounds like a plan! Let's meet at the library before the group study session to chat more about your research on gentrification.; Klaus Mueller: Thank you, Maria. I'm looking forward to our discussion before the group study session.; Maria Lopez: I'll see you at the library then, Klaus. Looking forward to our discussion.; Klaus Mueller: I'm glad you're interested in my research. I believe it's essential to shed light on the impact of gentrification in these communities."
33,"Maria Lopez: Hey Klaus, I couldn't help but notice you working on your research paper. What's your topic about?; Klaus Mueller: Hey Maria, my research paper is actually about the effects of gentrification in low-income communities.; Maria Lopez: That sounds really interesting! I'm studying physics but I'm always curious about social issues, especially how they affect different communities. Do you think gentrification can have positive impacts too?; Klaus Mueller: Absolutely, Maria! While gentrification can bring positive changes such as improved infrastructure and increased economic opportunities, it also often displaces long-time residents and alters the culture of a neighborhood. It's a complex issue with both pros and cons.; Maria Lopez: That's a really nuanced perspective, Klaus. Have you looked into any specific case studies on gentrification?; Klaus Mueller: Yes, Maria, I've been looking into case studies in cities like San Francisco and Brooklyn where gentrification has had significant impacts on communities. It's fascinating to see the different ways people are affected.; Maria Lopez: That's really interesting, Klaus. I would love to hear more about your research findings sometime.; Klaus Mueller: I'd be happy to share more with you sometime, Maria. Maybe we can grab coffee and discuss our research interests further?; Maria Lopez: That sounds great, Klaus! Let's plan to meet up next week for coffee and chat more about our research interests.; Klaus Mueller: Sounds like a plan, Maria. I'll message you to set up a time. Have a great day!; Maria Lopez: Thanks Klaus, I'm looking forward to our coffee meeting next week. Have a great day!; Klaus Mueller: Great, looking forward to it! Have a wonderful day, Maria!; Maria Lopez: Thanks Klaus, I'll message you my availability for next week. Looking forward to our coffee meeting!; Klaus Mueller: Great, looking forward to it! Have a wonderful day, Maria!"
34,"Maria Lopez: Hey Klaus! I couldn't help but notice you working on your research paper. What's your topic?; Klaus Mueller: Hey Maria! Thanks for noticing. I'm actually researching the effects of gentrification in low-income communities.; Maria Lopez: That sounds really interesting! I've always been intrigued by urban development issues. Have you come across any surprising findings so far?; Klaus Mueller: Yes, I actually found that some low-income communities experience both positive and negative impacts from gentrification. It's quite a complex issue.; Maria Lopez: That's really fascinating! I'd love to hear more about your research findings sometime. Maybe we can grab coffee and chat about it?; Klaus Mueller: That sounds great, I'd love to discuss my research with you over coffee. How about we meet at the campus cafe tomorrow afternoon?; Maria Lopez: Sounds like a plan! What time works best for you?; Klaus Mueller: How about 3:00 pm tomorrow? Does that work for you?; Maria Lopez: Great, 3:00 pm works for me! I look forward to our coffee chat tomorrow.; Klaus Mueller: Excellent! I'll see you at the campus cafe at 3:00 pm tomorrow then.; Maria Lopez: I'll see you tomorrow at 3:00 pm at the campus cafe!"
35,"Maria Lopez: Hey Klaus, I saw you working on your research paper in the library earlier. What's your paper about?; Klaus Mueller: Hey Maria, my research paper is actually about the effects of gentrification in low-income communities.; Maria Lopez: That sounds really interesting, Klaus. I'm actually studying physics, but I would love to hear more about your research. Maybe we can grab coffee sometime and you can tell me more about it?; Klaus Mueller: That sounds great, Maria. I would love to discuss my research with you over coffee. How about we meet at the campus cafe tomorrow afternoon?; Maria Lopez: Sure, that sounds good. I'll see you at the campus cafe tomorrow afternoon!; Klaus Mueller: Great, I'll see you at the campus cafe tomorrow afternoon. Looking forward to it!; Maria Lopez: What time works best for you? I have a break between my classes at 2pm and 4pm.; Klaus Mueller: How about we meet at 3 pm? That way we can have enough time to chat over coffee.; Maria Lopez: Great, 3 pm works for me. I'll see you then!"
36,"Maria Lopez: Hey Klaus, I noticed you're working on your research paper. How's it going so far?; Klaus Mueller: Hey Maria, it's going well so far. I'm currently working on the introduction. How about you, how's the physics lecture going?; Maria Lopez: The physics lecture is pretty interesting today. We were discussing quantum mechanics. Have you done any research related to that?; Klaus Mueller: That sounds fascinating! Quantum mechanics is such a complex but intriguing topic. I haven't done any specific research on it, but I find it really interesting. How do you find it applying to real-world scenarios?; Maria Lopez: I think the application of quantum mechanics in real-world scenarios is truly fascinating. It can explain phenomena at the atomic and subatomic levels which is mind-blowing. I'd love to chat more about this sometime.; Klaus Mueller: That sounds really interesting, Maria. I'd love to learn more about the practical applications of quantum mechanics. Maybe we can grab a coffee sometime and discuss it further.; Maria Lopez: That sounds like a great idea, Klaus! How about we meet at Hobbs Cafe tomorrow after my physics lecture at 1:00 pm?; Klaus Mueller: Sounds perfect, Maria! I'll see you at Hobbs Cafe tomorrow at 1:00 pm.; Maria Lopez: Great, looking forward to our chat tomorrow! I'll see you then."
