chat_id,Details
12,"Maria Lopez: Hey Klaus! I noticed you working on your research paper. What's your topic of study?; Klaus Mueller: Hey Maria! I'm actually researching the effects of gentrification in low-income communities. It's a topic I'm really passionate about.; Maria Lopez: That sounds really interesting! I would love to hear more about your research and maybe even collaborate on a project together.; Klaus Mueller: That would be amazing! I'd love to collaborate with you on this project. We could combine our perspectives and really make a difference.; Maria Lopez: How about we meet up later this week to discuss our ideas in more detail?; Klaus Mueller: That sounds great! Let's meet at the library on Thursday at 2:00 pm to go over our ideas.; Maria Lopez: I'm really excited about this collaboration! I'll see you on Thursday at the library.; Klaus Mueller: I'm looking forward to collaborating with you on this project. See you on Thursday!; Maria Lopez: Great! I'll make sure to come prepared with some initial ideas for our collaboration. See you on Thursday at 2:00 pm!; Klaus Mueller: I'll make sure to bring all my research data and findings for us to discuss on Thursday.; Maria Lopez: I'm really looking forward to working with you on this project. Let's create something impactful together.; Klaus Mueller: I can't wait to hear your thoughts and ideas on the project. It's going to be a great collaboration!; Maria Lopez: It was great chatting with you, Klaus! Looking forward to our meeting on Thursday."
13,"Maria Lopez: Hey Klaus, how's the research paper coming along? Need any help?; Klaus Mueller: Hey Maria, thanks for asking. I'm making good progress so far, just finalizing the introduction. Actually, do you have any insights on the effects of gentrification in low-income communities?; Maria Lopez: I actually wrote a paper on that topic last semester. I'd be happy to share some insights with you.; Klaus Mueller: That would be fantastic, Maria. I would greatly appreciate any insights you can provide on the topic.; Maria Lopez: I'll send you my paper on gentrification and we can discuss it further if you're interested.; Klaus Mueller: Thank you so much, Maria. I'm looking forward to reading your paper and discussing it with you. Would you like to grab coffee sometime this week to chat more about it?; Maria Lopez: Sure, Klaus. I'd love to grab coffee this week. How about Thursday afternoon?; Klaus Mueller: Great, Thursday afternoon works for me. Let's meet at the campus cafe around 2 pm?; Maria Lopez: Sounds good, see you on Thursday at 2 pm!"
14,"Maria Lopez: Hey Klaus! I noticed you were working on your research paper in the library. What is your paper about?; Klaus Mueller: Hey Maria! My research paper is actually on the effects of gentrification in low-income communities. It's been really interesting diving deep into this topic.; Maria Lopez: That sounds fascinating, I would love to hear more about your findings. Do you mind sharing some insights with me?; Klaus Mueller: Absolutely, I'd be happy to share some of my findings with you. One of the key aspects I've discovered is how gentrification can lead to displacement of long-time residents in these communities.; Maria Lopez: That's really eye-opening. Have you looked into any potential solutions or ways to mitigate this displacement?; Klaus Mueller: I have indeed looked into potential solutions. One approach that seems promising is to implement affordable housing initiatives to ensure that those who have lived in these communities for generations are not forced out.; Maria Lopez: That's a really thoughtful approach. I appreciate you shedding light on this topic. Have you considered any other strategies to address gentrification?; Klaus Mueller: I have also been exploring the idea of community land trusts as a means to provide long-term affordable housing options for residents.; Maria Lopez: Those are really innovative ideas, Klaus. I appreciate your dedication to finding solutions. Have you thought about collaborating with local community organizations to implement these initiatives?; Klaus Mueller: I think collaborating with local community organizations is a great idea. It would definitely help in implementing these initiatives effectively.; Maria Lopez: It's inspiring to see your dedication to helping communities. Have you thought about presenting your research at any upcoming conferences or local events?; Klaus Mueller: I have actually been considering presenting my research at upcoming conferences or local events. It would be a great way to raise awareness and gather feedback from community members.; Maria Lopez: That's fantastic, Klaus. I think your research could have a real impact on these communities. I'd love to hear more about your progress and perhaps even support your work in any way I can.; Klaus Mueller: Thank you for your support, Maria. I will definitely keep you updated on my progress and potentially discuss further collaboration opportunities.; Maria Lopez: I'm really impressed by your research, Klaus. If you need any assistance or support with your work, please don't hesitate to reach out to me.; Klaus Mueller: Thank you, Maria. I really appreciate your interest and support in my research. I will definitely reach out if I need any assistance or collaboration in the future."
15,"Maria Lopez: Hey Klaus, I couldn't help but notice you working on your research paper. What's your topic about?; Klaus Mueller: Hey Maria, my research paper is actually about the effects of gentrification in low-income communities. It's a topic I'm really passionate about.; Maria Lopez: That sounds really interesting, Klaus. I would love to hear more about your research and the findings you've come across.; Klaus Mueller: Thank you, Maria! I'd be happy to share more with you. Have you heard about the concept of urban displacement in relation to gentrification?; Maria Lopez: Yes, I'm familiar with the concept of urban displacement. It's a significant issue that can have far-reaching consequences. I'd love to hear more about your research and potential solutions to address this problem.; Klaus Mueller: I completely agree, Maria. Urban displacement can have such negative effects on communities. In my research, I've found that policy interventions focused on affordable housing and community engagement can help mitigate these issues. I'd be happy to share more specifics with you.; Maria Lopez: That's really insightful, Klaus. I'd be very interested in learning more about those policy interventions and how they could be implemented effectively in different communities.; Klaus Mueller: I'm glad you're interested in my research, Maria. I can definitely provide you with more information on the specific policies and strategies that have been successful in addressing urban displacement. Would you like to schedule a time to sit down and discuss this further?; Maria Lopez: That sounds great, Klaus. How about we meet at Hobbs Cafe tomorrow at 2:00 pm to discuss your research further?; Klaus Mueller: That sounds like a plan, Maria. I look forward to discussing my research with you further tomorrow at Hobbs Cafe at 2:00 pm.; Maria Lopez: Thanks, Klaus. I'm looking forward to our meeting at Hobbs Cafe tomorrow at 2:00 pm to discuss your research further.; Klaus Mueller: Great, I'll see you at Hobbs Cafe tomorrow at 2:00 pm. Looking forward to our discussion!; Maria Lopez: Thank you, Klaus. I'm really excited to dive deeper into your research and discuss potential solutions with you. See you tomorrow at Hobbs Cafe at 2:00 pm.; Klaus Mueller: I'm glad you're interested in my research, Maria. I can definitely provide you with more information on the specific policies and strategies that have been successful in addressing urban displacement. Would you like to schedule a time to sit down and discuss this further?; Maria Lopez: Thank you, Klaus. I'm really excited to dive deeper into your research and discuss potential solutions with you. See you tomorrow at Hobbs Cafe at 2:00 pm.; Klaus Mueller: I'm glad we could set up a time to discuss my research further. I look forward to our meeting at Hobbs Cafe tomorrow at 2:00 pm."
16,"Maria Lopez: Hi Klaus, I noticed you're working on your research paper. What is your topic about?; Klaus Mueller: Hi Maria, my research paper is about the effects of gentrification in low-income communities.; Maria Lopez: That sounds really interesting, I'm actually studying physics at Oak Hill College. Have you ever thought about how different physical environments could impact communities?; Klaus Mueller: That's a fascinating point, Maria. I believe physical environments play a significant role in shaping communities, especially in relation to access to resources and living conditions. It would be interesting to explore the intersection of social issues and environmental factors further.; Maria Lopez: I completely agree with you, Klaus. Do you think there are ways we could use physics principles to address some of these social and environmental challenges?; Klaus Mueller: I think applying physics principles to address social and environmental challenges is definitely a novel approach. It would be interesting to collaborate and see how we can integrate different fields to find innovative solutions.; Maria Lopez: I think it would be great to brainstorm ideas and see how we can combine our knowledge to work on these issues together. Would you be interested in discussing this further?; Klaus Mueller: I would love to discuss this further and see how we can collaborate. Let's set up a time to meet and brainstorm ideas.; Maria Lopez: Great! How about we meet at Hobbs Cafe tomorrow at 2:00 pm to discuss further?; Klaus Mueller: That sounds like a plan, Maria. I look forward to our meeting at Hobbs Cafe tomorrow at 2:00 pm.; Maria Lopez: Great! Looking forward to our meeting. See you tomorrow at Hobbs Cafe!"
17,"Maria Lopez: Hey Klaus, I couldn't help but notice you working on your research paper. What topic are you focusing on?; Klaus Mueller: Hey Maria, I'm actually researching the effects of gentrification in low-income communities. It's a topic I'm quite passionate about.; Maria Lopez: That sounds really interesting! I've read some articles on that topic before. Are you finding any specific trends or patterns in your research?; Klaus Mueller: Yes, I have actually found some interesting trends related to the displacement of long-time residents in these communities. It's a complex issue with a lot of different factors at play.; Maria Lopez: That's really fascinating. Have you considered conducting any interviews with residents in those communities to get a firsthand perspective?; Klaus Mueller: Actually, I have thought about that. I believe hearing directly from the residents would provide valuable insights. I'm planning to conduct some interviews soon.; Maria Lopez: That's a great idea! I think talking to people who are directly impacted by gentrification will definitely give you a more nuanced understanding of the issue. If you need any help with setting up interviews or any research assistance, feel free to reach out to me.; Klaus Mueller: Thank you, Maria. I really appreciate your offer to help with setting up interviews. I will definitely reach out to you for research assistance.; Maria Lopez: I'm glad to hear that you're considering diverse perspectives in your research. It's crucial to have a well-rounded understanding of such complex issues. Let me know if you need any help in analyzing the data or any other assistance.; Klaus Mueller: Thank you, Maria. I agree, diverse perspectives are crucial in understanding complex issues. I will definitely keep you in the loop and reach out for help when needed.; Maria Lopez: I'm really impressed by the work you're doing. If you ever want to discuss your findings or bounce off ideas, I'm always here to chat.; Klaus Mueller: Thank you, Maria. I appreciate your offer to discuss my findings and bounce off ideas. I will definitely keep that in mind.; Maria Lopez: I look forward to hearing more about your research progress. Keep up the great work, Klaus!; Klaus Mueller: Thank you, Maria. I'm glad we had this conversation and I really appreciate your support and encouragement.; Maria Lopez: I'm excited to see how your research unfolds. Maybe we can grab coffee sometime and you can share more details with me.; Klaus Mueller: I'd love to grab coffee with you and discuss my research further. How about we plan for next week?"
18,"Maria Lopez: Hey Klaus, I saw you working on your research paper in the library. What's your topic about?; Klaus Mueller: Hey Maria, my research paper is actually on the effects of gentrification in low-income communities. It's an area I'm really passionate about.; Maria Lopez: That sounds like a really interesting topic, Klaus. I would love to hear more about your research findings and maybe even contribute my perspective on the matter.; Klaus Mueller: Thank you, Maria. I would appreciate your input. Maybe we could meet up later this week to discuss it further?; Maria Lopez: That sounds great, Klaus. Let's meet up on Thursday afternoon to discuss your research in more detail.; Klaus Mueller: Great, let's meet at the library on Thursday at 3pm to discuss further.; Maria Lopez: Should we each bring some preliminary findings or research articles to share during our meeting on Thursday?; Klaus Mueller: That sounds like a plan. I'll bring some of my preliminary findings and research articles to discuss on Thursday afternoon.; Maria Lopez: I'll make sure to prepare my own research findings and articles to bring to our meeting on Thursday.; Klaus Mueller: Looking forward to our meeting on Thursday, Maria. Have a great day!; Maria Lopez: Thank you, Klaus. I'm excited to delve deeper into your research on Thursday. Have a great day!; Klaus Mueller: Shall we exchange contact information to stay in touch and coordinate for our meeting on Thursday?; Maria Lopez: Sure, let's exchange contact info. My number is 555-1234 and my email is marialopez@email.com.; Klaus Mueller: Great, thank you Maria. My number is 555-4321 and my email is klausmueller@email.com. Looking forward to our meeting on Thursday to discuss further.; Maria Lopez: Should we also consider inviting Professor Patel to our meeting on Thursday for additional insights?; Klaus Mueller: I think inviting Professor Patel to our meeting on Thursday would be a fantastic idea. They could provide valuable insights on the topic."
19,"Maria Lopez: Hey Klaus, I couldn't help but notice you working on your research paper. What is your topic about?; Klaus Mueller: Hey Maria, thanks for asking! My research paper is actually about the effects of gentrification in low-income communities.; Maria Lopez: That sounds really interesting! I've always been curious about how urban development impacts communities. Do you have any initial findings or insights you'd like to share?; Klaus Mueller: Thank you, Maria! I've found that gentrification often leads to the displacement of long-time residents and changes the social fabric of neighborhoods. It's a complex issue that requires a nuanced approach to understanding its full impact.; Maria Lopez: That's really insightful, Klaus. Have you looked into any potential solutions or interventions to mitigate the negative effects of gentrification?; Klaus Mueller: I have considered various community development strategies that focus on affordable housing and community engagement to address the negative impacts of gentrification. It's a work in progress, but I believe there are ways to create more inclusive urban spaces.; Maria Lopez: That's really interesting, Klaus. I would love to learn more about your research findings and the potential solutions you've come up with. Maybe we could grab a coffee sometime and discuss it further?; Klaus Mueller: That sounds great, Maria! I would love to discuss my research findings and potential solutions over coffee. How about we meet at Hobbs Cafe tomorrow at 2:00 pm?; Maria Lopez: Sure, that works for me, Klaus! I'm looking forward to our coffee chat tomorrow at Hobbs Cafe at 2:00 pm. See you then!; Klaus Mueller: Great, I'll see you at Hobbs Cafe tomorrow at 2:00 pm then!; Maria Lopez: Thank you, Klaus! I'm really excited to continue our conversation tomorrow at Hobbs Cafe. See you then!; Klaus Mueller: Looking forward to our discussion tomorrow at Hobbs Cafe! Have a great rest of your day, Maria.; Maria Lopez: Thank you, Klaus! I'm really excited to continue our conversation tomorrow at Hobbs Cafe. See you then!"
20,"Maria Lopez: Hey Klaus, I saw you working on your research paper in the library earlier. What are you researching?; Klaus Mueller: Hey Maria, I'm actually researching the effects of gentrification in low-income communities. It's a topic I'm really passionate about.; Maria Lopez: That sounds like a fascinating topic! I would love to hear more about your research findings.; Klaus Mueller: Thank you, Maria. I would be happy to share more about my research findings with you. When would be a good time for us to sit down and discuss it?; Maria Lopez: How about we meet at Hobbs Cafe tomorrow at 12pm? We can grab lunch and chat about your research.; Klaus Mueller: That sounds great, Maria. I'll see you at Hobbs Cafe tomorrow at 12pm.; Maria Lopez: Sounds good, looking forward to our chat tomorrow!"
21,"Maria Lopez: Hey Klaus, I couldn't help but notice you working on your research paper. What's your paper about?; Klaus Mueller: Hey Maria, my research paper is actually about the effects of gentrification in low-income communities. I'm really passionate about social justice and exploring different perspectives on this issue.; Maria Lopez: That sounds really interesting! I'd love to hear more about your research and maybe even collaborate on a project together.; Klaus Mueller: That would be great, Maria! I would love to hear your thoughts on the topic and see how we can work together. Maybe we can schedule a time to discuss it further?; Maria Lopez: Sure, how about we meet at Hobbs Cafe tomorrow at 2pm to further discuss our ideas?; Klaus Mueller: That sounds like a great idea, Maria! I look forward to meeting you at Hobbs Cafe tomorrow at 2pm. Thank you for showing interest in my research paper.; Maria Lopez: That works for me! I'll see you tomorrow at Hobbs Cafe at 2pm.; Klaus Mueller: Great, I'll prepare some notes and ideas to discuss further tomorrow. Looking forward to our meeting!; Maria Lopez: Great, Klaus! I will make sure to bring along my research notes as well. Looking forward to our discussion tomorrow at Hobbs Cafe at 2pm.; Klaus Mueller: I also wanted to ask, how are you finding the physics lecture? Are you enjoying it?; Maria Lopez: I'm actually really enjoying the physics lecture. It's fascinating to learn about the laws and principles that govern the universe.; Klaus Mueller: That's great to hear! Physics is such an intriguing subject. I'm glad you're enjoying the lecture.; Maria Lopez: Thank you, Klaus. I'm glad we had this conversation. I'll see you tomorrow at Hobbs Cafe at 2pm."
22,"Maria Lopez: Hey Klaus, I saw you working on your research paper at the library. What are you focusing on in your introduction?; Klaus Mueller: Hey Maria, I'm focusing on setting the context and explaining the importance of my research topic in the introduction.; Maria Lopez: That sounds intriguing, I would love to hear more about your research. Do you have any preliminary findings yet?; Klaus Mueller: Thank you, Maria. I do have some preliminary findings that I can share with you. It would be great to get your perspective on them.; Maria Lopez: I would love to learn more about your research findings and discuss them further.; Klaus Mueller: I can show you my preliminary findings and we can discuss them further if you're interested.; Maria Lopez: That sounds great, Klaus. I'm really looking forward to hearing more about your research and discussing it further.; Klaus Mueller: Let's head over to a quieter spot where we can go through the findings in more detail.; Maria Lopez: Sounds like a plan, let's go to the student lounge where we can have a more detailed discussion.; Klaus Mueller: Great, let's head over to the student lounge now to review the findings in more detail.; Maria Lopez: Hey Klaus, before we head to the student lounge, would you like to grab a coffee from Hobbs Cafe? It's one of my favorite spots on campus.; Klaus Mueller: That's a great idea, Maria. I could use a coffee before we delve into the findings. Let's head over to Hobbs Cafe.; Maria Lopez: Let's grab a table by the window, the view is amazing from there.; Klaus Mueller: This coffee is really good, thanks for suggesting it, Maria.; Maria Lopez: So, tell me more about the methodology you used in your research.; Klaus Mueller: I used a combination of qualitative interviews and quantitative surveys to gather data for my research."
23,"Maria Lopez: Hey Klaus, I noticed you were working on your research paper. What's your topic about?; Klaus Mueller: Hey Maria, my research paper is actually about the effects of gentrification in low-income communities. I'm trying to explore how it impacts the residents and the neighborhood as a whole.; Maria Lopez: That sounds really interesting! Have you found any specific patterns or trends in your research so far?; Klaus Mueller: Yes, I've actually found that there is a significant displacement of long-time residents and cultural changes that occur in these communities. It's a complex issue with various implications.; Maria Lopez: That's really insightful. I would love to hear more about your findings and the methodologies you used for your research.; Klaus Mueller: I'd be happy to share more details with you. Maybe we can grab a coffee sometime and discuss it further.; Maria Lopez: That would be great! How about we meet at Hobbs Cafe tomorrow at 10am?; Klaus Mueller: Sounds like a plan! I'll see you at Hobbs Cafe tomorrow at 10am.; Maria Lopez: I'm looking forward to hearing more about your research tomorrow!; Klaus Mueller: Great, looking forward to our meeting tomorrow at Hobbs Cafe!; Maria Lopez: I'll make sure to bring my notes and some of my physics study materials so we can compare notes and maybe even find some connections between our research areas.; Klaus Mueller: I think it would be really interesting to see how the social implications of gentrification intersect with the physical changes in these communities. It could provide a well-rounded view of the issue.; Maria Lopez: I agree, there could be some interesting parallels between the social and physical aspects of gentrification. I'll definitely bring my notes tomorrow so we can delve deeper into this.; Klaus Mueller: I think it would be valuable to examine the long-term effects of gentrification on these communities as well. It could provide a more comprehensive understanding of the issue.; Maria Lopez: I think examining the long-term effects of gentrification would definitely add a new layer to our understanding of the issue. I'll bring some research articles on urban development as well to see if there are any connections.; Klaus Mueller: I think considering the economic implications of gentrification would also be crucial in understanding the full scope of the issue. Perhaps we could explore that aspect further during our meeting tomorrow."
